Name,PhotoURL,Tags,Description,Cook Time,Difficulty,Method
Honey Butter Chicken,/image/honeybutterchicken.jpg,,"Honey butter chicken: sweet, savory, and melt-in-your-mouth delicious!",20,3,"Cut your chicken into inch think chunks. Combine cornstarch, salt, pepper and garlic powered and derdge your throughly. Put the chicken in the air frier and spay them with oil and cook for 18 minuites at 375 degrees. For the sauce, combine soy sauce, ginger and honey and mix thoroughly. In a pan, melt butter and cooked until reduced. Combine the chicken with the sauce."
Butter Chicken,/image/butterchicken.jpg,butterchicken dinner indianfood,Classic Butter Chicken by @AmateurProChef. What’s your order: butter chicken or chicken tikka?,15,3,"Slice the red onion and roughly chop up the tomatoes. Put oil in a pan and add garlic and onion and let that caramelize. Add the tomatoes and let that cook down until soft. Mix in the spices. Blend it all up and add it back to the pan and mix in cream, sugar and fenugreek leaves. For the chicken, you want to cube it up and marinate it with yogurt and the same spices as before. Fry the chicken for 12 minuites at 380F and add it to the sauce."
Big Mac Taco,/image/bigmactaco.jpg,bigmac tacos,"Big Mac Tacos by @healthyfitbella_ I've made them a few times now and they are such a handy midweek dinner, they are so quick to make and the kids love them too.",10,2,"Flatten mince on tortilla wrap & season with garlic, onion salt & salt! Heat olive oil in a pan & cook on meat side for 5-6 mins & flip over and repeat. Add cheese and cover to melt. Serve with lettuce, pickles, onion & burger sauce."
Watermelon Shaved Ice,/image/watermelonshavedice.jpg,crunchy frozen fruit healthy kitchenhack shavedice snack summerfood sweet simple,VIRAL WATERMELON SHAVED ICE!,45,1,Cut watermalling into blocks and freeze until frozen. Grate the frozen watermelon into a bowl. Pour honey and lime over the shavings.
Cucumber Salad,/image/cucumbersalad.jpg,healthy,Healthy snack inspo.,5,1,Cut the cucumbers into a spiral shape and season with salt. Mix in the rest of the ingredients.
Fire Chicken,/image/firechicken.jpg,featured,The traditional cuisine of stewed chicken with chicken feathers and ash is so vast and full of surprises in the world of food.,15,4,"Roast the chicken over a fire until blackened. Scrape off the ash and gather it into a bowl and grind it up. Chop up the chicken and place into a pot with water to cook. After a few minuites, mix in the ash and let it cook futher. Once fully cooked the dish is done."
Egg Fried Rice,/image/eggfriedrice.jpg,chinesefood yummy,"Egg fried rice, easy Chinese food recipes.",10,3,"Cook the rice seperately. Break 3 eggs into a pan and cook them scrambled, then break them up. Mix the egg, rice, salt block pepper, soy suace and scallion in the pan and let cook for a couple of minuites."
Tiramisu,/image/tiramisu.jpg,baking brownies tiramisu dessert sweettreat easyrecipe,Honestly better than classic brownies!,25,5,"Preheat your oven to 170°C. Brown the butter in a pan, then melt the chocolate separately. Stir them together and let the mixture cool slightly. In a large bowl, whisk the eggs and caster sugar until pale and fluffy. Add the chocolate and butter mixture to the eggs and sugar, whisk to combine. Sift in the flour, cocoa powder and salt, then fold until just incorporated. Pour the batter into a lined square tin and spread evenly. Bake for 22 minutes. Let it cool completely in the tin. Brew about 150ml of strong coffee and allow it to cool. Briefly dip each ladyfinger into the coffee, then arrange them tightly in a single layer over the cooled brownie base. In a bowl, whip the double cream to soft peaks. Add the sugar and mascarpone, then beat until the mixture is thick and smooth. Spread the mascarpone cream evenly over the ladyfinger layer. Cover the tin with foil or cling film and refrigerate overnight (at least 8 hours). Just before serving, dust the top with unsweetened cocoa powder."
